CREATE TABLE toasttest(descr text, cnt int DEFAULT 0, f1 text, f2 text);
CREATE TABLE
INSERT INTO toasttest(descr, f1, f2) VALUES('two-compressed', repeat('1234567890',1000), repeat('1234567890',1000));
INSERT 0 1
INSERT INTO toasttest(descr, f1, f2) VALUES('two-toasted', repeat('1234567890',30000), repeat('1234567890',50000));
INSERT 0 1
INSERT INTO toasttest(descr, f1, f2) VALUES('one-compressed,one-null', NULL, repeat('1234567890',1000));
INSERT 0 1
INSERT INTO toasttest(descr, f1, f2) VALUES('one-toasted,one-null', NULL, repeat('1234567890',50000));
INSERT 0 1
-- check whether indirect tuples works on the most basic level
SELECT descr, substring(make_tuple_indirect(toasttest)::text, 1, 200) FROM toasttest;
ERROR:  42883: function make_tuple_indirect(toasttest) does not exist
LINE 1: SELECT descr, substring(make_tuple_indirect(toasttest)::text...
                                ^
HINT:  No function matches the given name and argument types. You might need to add explicit type casts.
-- modification without changing varlenas
UPDATE toasttest SET cnt = cnt +1 RETURNING substring(toasttest::text, 1, 200);
                                                                                                substring                                                                                                 
----------------------------------------------------------------------------------------------------------------------------------------------------------------------------------------------------------
 (two-compressed,1,12345678901234567890123456789012345678901234567890123456789012345678901234567890123456789012345678901234567890123456789012345678901234567890123456789012345678901234567890123456789012
 (two-toasted,1,12345678901234567890123456789012345678901234567890123456789012345678901234567890123456789012345678901234567890123456789012345678901234567890123456789012345678901234567890123456789012345
 ("one-compressed,one-null",1,,12345678901234567890123456789012345678901234567890123456789012345678901234567890123456789012345678901234567890123456789012345678901234567890123456789012345678901234567890
 ("one-toasted,one-null",1,,12345678901234567890123456789012345678901234567890123456789012345678901234567890123456789012345678901234567890123456789012345678901234567890123456789012345678901234567890123
(4 rows)

UPDATE 4
-- modification without modifying assigned value
UPDATE toasttest SET cnt = cnt +1, f1 = f1 RETURNING substring(toasttest::text, 1, 200);
                                                                                                substring                                                                                                 
----------------------------------------------------------------------------------------------------------------------------------------------------------------------------------------------------------
 (two-compressed,2,12345678901234567890123456789012345678901234567890123456789012345678901234567890123456789012345678901234567890123456789012345678901234567890123456789012345678901234567890123456789012
 (two-toasted,2,12345678901234567890123456789012345678901234567890123456789012345678901234567890123456789012345678901234567890123456789012345678901234567890123456789012345678901234567890123456789012345
 ("one-compressed,one-null",2,,12345678901234567890123456789012345678901234567890123456789012345678901234567890123456789012345678901234567890123456789012345678901234567890123456789012345678901234567890
 ("one-toasted,one-null",2,,12345678901234567890123456789012345678901234567890123456789012345678901234567890123456789012345678901234567890123456789012345678901234567890123456789012345678901234567890123
(4 rows)

UPDATE 4
-- modification modifying, but effectively not changing
UPDATE toasttest SET cnt = cnt +1, f1 = f1||'' RETURNING substring(toasttest::text, 1, 200);
                                                                                                substring                                                                                                 
----------------------------------------------------------------------------------------------------------------------------------------------------------------------------------------------------------
 (two-compressed,3,12345678901234567890123456789012345678901234567890123456789012345678901234567890123456789012345678901234567890123456789012345678901234567890123456789012345678901234567890123456789012
 (two-toasted,3,12345678901234567890123456789012345678901234567890123456789012345678901234567890123456789012345678901234567890123456789012345678901234567890123456789012345678901234567890123456789012345
 ("one-compressed,one-null",3,,12345678901234567890123456789012345678901234567890123456789012345678901234567890123456789012345678901234567890123456789012345678901234567890123456789012345678901234567890
 ("one-toasted,one-null",3,,12345678901234567890123456789012345678901234567890123456789012345678901234567890123456789012345678901234567890123456789012345678901234567890123456789012345678901234567890123
(4 rows)

UPDATE 4
UPDATE toasttest SET cnt = cnt +1, f1 = '-'||f1||'-' RETURNING substring(toasttest::text, 1, 200);
                                                                                                substring                                                                                                 
----------------------------------------------------------------------------------------------------------------------------------------------------------------------------------------------------------
 (two-compressed,4,-1234567890123456789012345678901234567890123456789012345678901234567890123456789012345678901234567890123456789012345678901234567890123456789012345678901234567890123456789012345678901
 (two-toasted,4,-1234567890123456789012345678901234567890123456789012345678901234567890123456789012345678901234567890123456789012345678901234567890123456789012345678901234567890123456789012345678901234
 ("one-compressed,one-null",4,,12345678901234567890123456789012345678901234567890123456789012345678901234567890123456789012345678901234567890123456789012345678901234567890123456789012345678901234567890
 ("one-toasted,one-null",4,,12345678901234567890123456789012345678901234567890123456789012345678901234567890123456789012345678901234567890123456789012345678901234567890123456789012345678901234567890123
(4 rows)

UPDATE 4
SELECT substring(toasttest::text, 1, 200) FROM toasttest;
                                                                                                substring                                                                                                 
----------------------------------------------------------------------------------------------------------------------------------------------------------------------------------------------------------
 (two-compressed,4,-1234567890123456789012345678901234567890123456789012345678901234567890123456789012345678901234567890123456789012345678901234567890123456789012345678901234567890123456789012345678901
 (two-toasted,4,-1234567890123456789012345678901234567890123456789012345678901234567890123456789012345678901234567890123456789012345678901234567890123456789012345678901234567890123456789012345678901234
 ("one-compressed,one-null",4,,12345678901234567890123456789012345678901234567890123456789012345678901234567890123456789012345678901234567890123456789012345678901234567890123456789012345678901234567890
 ("one-toasted,one-null",4,,12345678901234567890123456789012345678901234567890123456789012345678901234567890123456789012345678901234567890123456789012345678901234567890123456789012345678901234567890123
(4 rows)

-- check we didn't screw with main/toast tuple visibility
VACUUM FREEZE toasttest;
VACUUM
SELECT substring(toasttest::text, 1, 200) FROM toasttest;
                                                                                                substring                                                                                                 
----------------------------------------------------------------------------------------------------------------------------------------------------------------------------------------------------------
 (two-compressed,4,-1234567890123456789012345678901234567890123456789012345678901234567890123456789012345678901234567890123456789012345678901234567890123456789012345678901234567890123456789012345678901
 (two-toasted,4,-1234567890123456789012345678901234567890123456789012345678901234567890123456789012345678901234567890123456789012345678901234567890123456789012345678901234567890123456789012345678901234
 ("one-compressed,one-null",4,,12345678901234567890123456789012345678901234567890123456789012345678901234567890123456789012345678901234567890123456789012345678901234567890123456789012345678901234567890
 ("one-toasted,one-null",4,,12345678901234567890123456789012345678901234567890123456789012345678901234567890123456789012345678901234567890123456789012345678901234567890123456789012345678901234567890123
(4 rows)

-- now create a trigger that forces all Datums to be indirect ones
CREATE FUNCTION update_using_indirect()
        RETURNS trigger
        LANGUAGE plpgsql AS $$
BEGIN
    NEW := make_tuple_indirect(NEW);
    RETURN NEW;
END$$;
CREATE FUNCTION
CREATE TRIGGER toasttest_update_indirect
        BEFORE INSERT OR UPDATE
        ON toasttest
        FOR EACH ROW
        EXECUTE PROCEDURE update_using_indirect();
CREATE TRIGGER
-- modification without changing varlenas
UPDATE toasttest SET cnt = cnt +1 RETURNING substring(toasttest::text, 1, 200);
ERROR:  42883: function make_tuple_indirect(toasttest) does not exist
LINE 1: SELECT make_tuple_indirect(NEW)
               ^
HINT:  No function matches the given name and argument types. You might need to add explicit type casts.
QUERY:  SELECT make_tuple_indirect(NEW)
CONTEXT:  PL/pgSQL function update_using_indirect() line 3 at assignment
-- modification without modifying assigned value
UPDATE toasttest SET cnt = cnt +1, f1 = f1 RETURNING substring(toasttest::text, 1, 200);
ERROR:  42883: function make_tuple_indirect(toasttest) does not exist
LINE 1: SELECT make_tuple_indirect(NEW)
               ^
HINT:  No function matches the given name and argument types. You might need to add explicit type casts.
QUERY:  SELECT make_tuple_indirect(NEW)
CONTEXT:  PL/pgSQL function update_using_indirect() line 3 at assignment
-- modification modifying, but effectively not changing
UPDATE toasttest SET cnt = cnt +1, f1 = f1||'' RETURNING substring(toasttest::text, 1, 200);
ERROR:  42883: function make_tuple_indirect(toasttest) does not exist
LINE 1: SELECT make_tuple_indirect(NEW)
               ^
HINT:  No function matches the given name and argument types. You might need to add explicit type casts.
QUERY:  SELECT make_tuple_indirect(NEW)
CONTEXT:  PL/pgSQL function update_using_indirect() line 3 at assignment
UPDATE toasttest SET cnt = cnt +1, f1 = '-'||f1||'-' RETURNING substring(toasttest::text, 1, 200);
ERROR:  42883: function make_tuple_indirect(toasttest) does not exist
LINE 1: SELECT make_tuple_indirect(NEW)
               ^
HINT:  No function matches the given name and argument types. You might need to add explicit type casts.
QUERY:  SELECT make_tuple_indirect(NEW)
CONTEXT:  PL/pgSQL function update_using_indirect() line 3 at assignment
INSERT INTO toasttest(descr, f1, f2) VALUES('one-toasted,one-null, via indirect', repeat('1234567890',30000), NULL);
ERROR:  42883: function make_tuple_indirect(toasttest) does not exist
LINE 1: SELECT make_tuple_indirect(NEW)
               ^
HINT:  No function matches the given name and argument types. You might need to add explicit type casts.
QUERY:  SELECT make_tuple_indirect(NEW)
CONTEXT:  PL/pgSQL function update_using_indirect() line 3 at assignment
SELECT substring(toasttest::text, 1, 200) FROM toasttest;
                                                                                                substring                                                                                                 
----------------------------------------------------------------------------------------------------------------------------------------------------------------------------------------------------------
 (two-compressed,4,-1234567890123456789012345678901234567890123456789012345678901234567890123456789012345678901234567890123456789012345678901234567890123456789012345678901234567890123456789012345678901
 (two-toasted,4,-1234567890123456789012345678901234567890123456789012345678901234567890123456789012345678901234567890123456789012345678901234567890123456789012345678901234567890123456789012345678901234
 ("one-compressed,one-null",4,,12345678901234567890123456789012345678901234567890123456789012345678901234567890123456789012345678901234567890123456789012345678901234567890123456789012345678901234567890
 ("one-toasted,one-null",4,,12345678901234567890123456789012345678901234567890123456789012345678901234567890123456789012345678901234567890123456789012345678901234567890123456789012345678901234567890123
(4 rows)

-- check we didn't screw with main/toast tuple visibility
VACUUM FREEZE toasttest;
VACUUM
SELECT substring(toasttest::text, 1, 200) FROM toasttest;
                                                                                                substring                                                                                                 
----------------------------------------------------------------------------------------------------------------------------------------------------------------------------------------------------------
 (two-compressed,4,-1234567890123456789012345678901234567890123456789012345678901234567890123456789012345678901234567890123456789012345678901234567890123456789012345678901234567890123456789012345678901
 (two-toasted,4,-1234567890123456789012345678901234567890123456789012345678901234567890123456789012345678901234567890123456789012345678901234567890123456789012345678901234567890123456789012345678901234
 ("one-compressed,one-null",4,,12345678901234567890123456789012345678901234567890123456789012345678901234567890123456789012345678901234567890123456789012345678901234567890123456789012345678901234567890
 ("one-toasted,one-null",4,,12345678901234567890123456789012345678901234567890123456789012345678901234567890123456789012345678901234567890123456789012345678901234567890123456789012345678901234567890123
(4 rows)

DROP TABLE toasttest;
DROP TABLE
DROP FUNCTION update_using_indirect();
DROP FUNCTION
